{
  "segment_id": "segment_ghibli_kitchen_001_v1",
  "phase": "PHASE-SOURCE-VIDEO-008-SOURCE_VIDEO_SCENE_SEGMENT_SCHEMA_V1",
  "source_video_id": "GHIBLI_01",
  "segment_index": 1,
  "timestamp_start": 48,
  "timestamp_end": 72,
  "duration_seconds": 24,
  "segment_type": "kitchen_blocking",
  "director_family": "GHIBLI",
  "dominant_grammar": "blocking_grammar",
  "location_context": {
    "summary": "Domestic kitchen with hearth-centered blocking geometry",
    "tokens": [
      "mediterranean-harbor",
      "village-street-life",
      "seated-conversation triangles",
      "counter-exchange staging",
      "doorway-threshold pauses"
    ]
  },
  "character_context": {
    "summary": "Two-character counter-and-hearth ensemble",
    "tokens": [
      "seated-conversation triangles",
      "counter-exchange staging",
      "warmth-through-routine",
      "longing-in-departure",
      "doorway-threshold pauses"
    ]
  },
  "camera_context": {
    "summary": "Eye-level two-shot medium with patient observational framing",
    "tokens": [
      "establishing-wide before intimacy",
      "eye-level dialogue pairs",
      "seated-conversation triangles",
      "counter-exchange staging",
      "doorway-threshold pauses"
    ]
  },
  "lighting_context": {
    "summary": "Morning-window wash with warm interior practicals",
    "tokens": [
      "morning-window wash",
      "golden-hour exterior glow",
      "seated-conversation triangles",
      "counter-exchange staging",
      "doorway-threshold pauses"
    ]
  },
  "motion_context": {
    "summary": "Task-detail close-ups and tracking-walk with deep focus",
    "tokens": [
      "slow-contemplative-walk",
      "meal-prep-task-motion",
      "seated-conversation triangles",
      "counter-exchange staging",
      "doorway-threshold pauses"
    ]
  },
  "emotion_context": {
    "summary": "Warmth-through-routine with calm domestic intimacy",
    "tokens": [
      "warmth-through-routine",
      "longing-in-departure",
      "seated-conversation triangles",
      "counter-exchange staging",
      "doorway-threshold pauses"
    ]
  },
  "transition_in": "establishing_hold",
  "transition_out": "gentle_cut",
  "coordinate_template_ref": "movie_coord_ghibli_kitchen_blocking_v1",
  "scene_state_mapping_ref": "map_ghibli_kitchen_to_scene_state_v1",
  "video_state_defaults_ref": "video-state-defaults-v1",
  "director_grammar_ref": "director_grammar_ghibli_v1",
  "execution_flags": {
    "design_only": true,
    "gpu_execution": false,
    "external_call_allowed": false,
    "frame_extraction": false,
    "ocr": false,
    "generation": false
  },
  "built_at": "2026-06-05T07:25:19.057Z"
}
