{
  "segment_id": "segment_live_action_dialogue_001_v1",
  "phase": "PHASE-SOURCE-VIDEO-008-SOURCE_VIDEO_SCENE_SEGMENT_SCHEMA_V1",
  "source_video_id": "LITTLE_WOMEN_01",
  "segment_index": 1,
  "timestamp_start": 95,
  "timestamp_end": 128,
  "duration_seconds": 33,
  "segment_type": "dialogue_blocking",
  "director_family": "LIVE_ACTION",
  "dominant_grammar": "blocking_grammar",
  "location_context": {
    "summary": "Interior social space with hearth or table ensemble",
    "tokens": [
      "parlor-interior",
      "snowy-lane",
      "hearth-circle",
      "dining-table-ensemble",
      "doorway-greeting"
    ]
  },
  "character_context": {
    "summary": "Family ensemble with relationship-implied staging",
    "tokens": [
      "hearth-circle",
      "dining-table-ensemble",
      "pride-in-composure",
      "tenderness-in-small-gesture",
      "doorway-greeting"
    ]
  },
  "camera_context": {
    "summary": "Eye-level dialogue pairs with motivated reframes",
    "tokens": [
      "master-two-shot",
      "over-shoulder-dialogue",
      "hearth-circle",
      "dining-table-ensemble",
      "doorway-greeting"
    ]
  },
  "lighting_context": {
    "summary": "Practical interior warmth with soft shadow rolloff",
    "tokens": [
      "window-side-key",
      "fireplace-warm-fill",
      "hearth-circle",
      "dining-table-ensemble",
      "doorway-greeting"
    ]
  },
  "motion_context": {
    "summary": "Minimal performance beats preserving blocking geometry",
    "tokens": [
      "seated-gesture",
      "doorway-entry",
      "hearth-circle",
      "dining-table-ensemble",
      "doorway-greeting"
    ]
  },
  "emotion_context": {
    "summary": "Subtext-over-dialogue emotional carry",
    "tokens": [
      "pride-in-composure",
      "tenderness-in-small-gesture",
      "hearth-circle",
      "dining-table-ensemble",
      "doorway-greeting"
    ]
  },
  "transition_in": "scene_entry_cut",
  "transition_out": "dialogue_beat_hold",
  "coordinate_template_ref": "movie_coord_live_action_dialogue_blocking_v1",
  "scene_state_mapping_ref": "map_live_action_dialogue_to_scene_state_v1",
  "video_state_defaults_ref": "video-state-defaults-v1",
  "director_grammar_ref": "director_grammar_live_action_v1",
  "execution_flags": {
    "design_only": true,
    "gpu_execution": false,
    "external_call_allowed": false,
    "frame_extraction": false,
    "ocr": false,
    "generation": false
  },
  "built_at": "2026-06-05T07:25:19.058Z"
}
